sentiment,text,cleaned_text,tokenized_text,POS tagged,Lemma
Negative,The staff was not communicative and didn't provide clear information about my treatment.,staff communicative provide clear information treatment,"['staff', 'communicative', 'provide', 'clear', 'information', 'treatment']","[('staff', 'n'), ('communicative', 'a'), ('provide', 'n'), ('clear', 'a'), ('information', 'n'), ('treatment', 'n')]",  staff communicative provide clear information treatment
Negative,The hospital environment was unclean and didn't feel sanitary.,hospital environment unclean feel sanitary,"['hospital', 'environment', 'unclean', 'feel', 'sanitary']","[('hospital', 'n'), ('environment', 'n'), ('unclean', 'a'), ('feel', 'n'), ('sanitary', 'a')]",  hospital environment unclean feel sanitary
Negative,The doctor seemed rushed and didn't take the time to listen to my concerns.,doctor seemed rushed take time listen concerns,"['doctor', 'seemed', 'rushed', 'take', 'time', 'listen', 'concerns']","[('doctor', 'n'), ('seemed', 'v'), ('rushed', 'a'), ('take', 'n'), ('time', 'n'), ('listen', 'a'), ('concerns', 'n')]",  doctor seem rushed take time listen concern
Negative,I had to wait for an extended period before receiving treatment.,wait extended period receiving treatment,"['wait', 'extended', 'period', 'receiving', 'treatment']","[('wait', 'n'), ('extended', 'v'), ('period', 'n'), ('receiving', 'n'), ('treatment', 'n')]",  wait extend period receiving treatment
Negative,The staff was rude and dismissive of my concerns.,staff rude dismissive concerns,"['staff', 'rude', 'dismissive', 'concerns']","[('staff', 'n'), ('rude', 'v'), ('dismissive', 'a'), ('concerns', 'n')]",  staff rude dismissive concern
Negative,"The hospital was overcrowded, and it was difficult to move around or get assistance.",hospital overcrowded difficult move around get assistance,"['hospital', 'overcrowded', 'difficult', 'move', 'around', 'get', 'assistance']","[('hospital', 'n'), ('overcrowded', 'v'), ('difficult', 'a'), ('move', 'n'), ('around', None), ('get', 'n'), ('assistance', 'n')]",  hospital overcrowd difficult move around get assistance
Negative,The nursing staff didn't respond to my requests for pain relief in a timely manner.,nursing staff respond requests pain relief timely manner,"['nursing', 'staff', 'respond', 'requests', 'pain', 'relief', 'timely', 'manner']","[('nursing', 'a'), ('staff', 'n'), ('respond', 'n'), ('requests', 'n'), ('pain', 'v'), ('relief', 'n'), ('timely', 'a'), ('manner', 'n')]",  nursing staff respond request pain relief timely manner
Negative,"The hospital lacked privacy, and I could hear conversations between patients and staff members in adjacent rooms.",hospital lacked privacy could hear conversations patients staff members adjacent rooms,"['hospital', 'lacked', 'privacy', 'could', 'hear', 'conversations', 'patients', 'staff', 'members', 'adjacent', 'rooms']","[('hospital', 'n'), ('lacked', 'v'), ('privacy', 'n'), ('could', None), ('hear', 'v'), ('conversations', 'n'), ('patients', 'n'), ('staff', 'n'), ('members', 'n'), ('adjacent', 'v'), ('rooms', 'n')]",  hospital lack privacy could hear conversation patient staff member adjacent room
Negative,The medical equipment in the hospital was outdated and malfunctioned during my treatment.,medical equipment hospital outdated malfunctioned treatment,"['medical', 'equipment', 'hospital', 'outdated', 'malfunctioned', 'treatment']","[('medical', 'a'), ('equipment', 'n'), ('hospital', 'n'), ('outdated', 'v'), ('malfunctioned', 'a'), ('treatment', 'n')]",  medical equipment hospital outdated malfunctioned treatment
Negative,I received conflicting information from different staff members about my condition and treatment plan.,received conflicting information different staff members condition treatment plan,"['received', 'conflicting', 'information', 'different', 'staff', 'members', 'condition', 'treatment', 'plan']","[('received', 'v'), ('conflicting', 'v'), ('information', 'n'), ('different', 'a'), ('staff', 'n'), ('members', 'n'), ('condition', 'v'), ('treatment', 'n'), ('plan', 'n')]",  receive conflict information different staff member condition treatment plan
Negative,The hospital didn't provide adequate accommodations for my disabilities.,hospital provide adequate accommodations disabilities,"['hospital', 'provide', 'adequate', 'accommodations', 'disabilities']","[('hospital', 'n'), ('provide', 'n'), ('adequate', 'a'), ('accommodations', 'n'), ('disabilities', 'n')]",  hospital provide adequate accommodation disability
Negative,The food provided by the hospital was unappetizing and lacked variety.,food provided hospital unappetizing lacked variety,"['food', 'provided', 'hospital', 'unappetizing', 'lacked', 'variety']","[('food', 'n'), ('provided', 'v'), ('hospital', 'n'), ('unappetizing', 'n'), ('lacked', 'v'), ('variety', 'n')]",  food provide hospital unappetizing lack variety
Negative,The hospital didn't provide sufficient support for my mental health needs.,hospital provide sufficient support mental health needs,"['hospital', 'provide', 'sufficient', 'support', 'mental', 'health', 'needs']","[('hospital', 'n'), ('provide', 'n'), ('sufficient', 'a'), ('support', 'n'), ('mental', 'a'), ('health', 'n'), ('needs', 'n')]",  hospital provide sufficient support mental health need
Negative,I didn't feel that my cultural or religious needs were respected by hospital staff.,feel cultural religious needs respected hospital staff,"['feel', 'cultural', 'religious', 'needs', 'respected', 'hospital', 'staff']","[('feel', 'v'), ('cultural', 'a'), ('religious', 'a'), ('needs', 'n'), ('respected', 'v'), ('hospital', 'a'), ('staff', 'n')]",  feel cultural religious need respect hospital staff
Negative,"The hospital didn't have adequate security measures in place, and I felt unsafe during my stay.",hospital adequate security measures place felt unsafe stay,"['hospital', 'adequate', 'security', 'measures', 'place', 'felt', 'unsafe', 'stay']","[('hospital', 'n'), ('adequate', 'a'), ('security', 'n'), ('measures', 'n'), ('place', 'v'), ('felt', 'v'), ('unsafe', 'a'), ('stay', 'n')]",  hospital adequate security measure place felt unsafe stay
Negative,The hospital didn't provide adequate follow-up care after I was discharged.,hospital provide adequate follow care discharged,"['hospital', 'provide', 'adequate', 'follow', 'care', 'discharged']","[('hospital', 'n'), ('provide', 'n'), ('adequate', 'v'), ('follow', 'a'), ('care', 'n'), ('discharged', 'v')]",  hospital provide adequate follow care discharge
Negative,"The hospital was disorganized, and it was difficult to navigate the system.",hospital disorganized difficult navigate system,"['hospital', 'disorganized', 'difficult', 'navigate', 'system']","[('hospital', 'n'), ('disorganized', 'v'), ('difficult', 'a'), ('navigate', 'n'), ('system', 'n')]",  hospital disorganize difficult navigate system
Negative,"The hospital was understaffed, and staff members seemed overwhelmed and overworked.",hospital understaffed staff members seemed overwhelmed overworked,"['hospital', 'understaffed', 'staff', 'members', 'seemed', 'overwhelmed', 'overworked']","[('hospital', 'n'), ('understaffed', 'a'), ('staff', 'n'), ('members', 'n'), ('seemed', 'v'), ('overwhelmed', 'a'), ('overworked', 'v')]",  hospital understaffed staff member seem overwhelmed overwork
Negative,I didn't receive appropriate accommodations for my language needs.,receive appropriate accommodations language needs,"['receive', 'appropriate', 'accommodations', 'language', 'needs']","[('receive', 'a'), ('appropriate', 'a'), ('accommodations', 'n'), ('language', 'n'), ('needs', 'n')]",  receive appropriate accommodation language need
Negative,The hospital didn't have adequate resources or accommodations for my young child during my stay.,hospital adequate resources accommodations young child stay,"['hospital', 'adequate', 'resources', 'accommodations', 'young', 'child', 'stay']","[('hospital', 'n'), ('adequate', 'a'), ('resources', 'n'), ('accommodations', 'n'), ('young', 'a'), ('child', 'v'), ('stay', 'v')]",  hospital adequate resource accommodation young child stay
Negative,"The hospital didn't have enough equipment or supplies, causing delays in my treatment.",hospital enough equipment supplies causing delays treatment,"['hospital', 'enough', 'equipment', 'supplies', 'causing', 'delays', 'treatment']","[('hospital', 'n'), ('enough', 'a'), ('equipment', 'n'), ('supplies', 'n'), ('causing', 'v'), ('delays', 'n'), ('treatment', 'n')]",  hospital enough equipment supply cause delay treatment
Negative,The hospital didn't provide adequate pain management for my condition.,hospital provide adequate pain management condition,"['hospital', 'provide', 'adequate', 'pain', 'management', 'condition']","[('hospital', 'n'), ('provide', 'n'), ('adequate', 'n'), ('pain', 'n'), ('management', 'n'), ('condition', 'n')]",  hospital provide adequate pain management condition
Negative,The hospital was noisy and disrupted my ability to rest and recover.,hospital noisy disrupted ability rest recover,"['hospital', 'noisy', 'disrupted', 'ability', 'rest', 'recover']","[('hospital', 'n'), ('noisy', 'r'), ('disrupted', 'v'), ('ability', 'n'), ('rest', 'n'), ('recover', 'n')]",  hospital noisy disrupt ability rest recover
Negative,The hospital didn't provide me with enough information about the potential side effects of my medication.,hospital provide enough information potential side effects medication,"['hospital', 'provide', 'enough', 'information', 'potential', 'side', 'effects', 'medication']","[('hospital', 'n'), ('provide', 'r'), ('enough', 'a'), ('information', 'n'), ('potential', 'a'), ('side', 'n'), ('effects', 'n'), ('medication', 'n')]",  hospital provide enough information potential side effect medication
Negative,The hospital didn't provide me with enough information about the risks and benefits of my treatment options.,hospital provide enough information risks benefits treatment options,"['hospital', 'provide', 'enough', 'information', 'risks', 'benefits', 'treatment', 'options']","[('hospital', 'n'), ('provide', 'r'), ('enough', 'a'), ('information', 'n'), ('risks', 'n'), ('benefits', 'n'), ('treatment', 'n'), ('options', 'n')]",  hospital provide enough information risk benefit treatment option
Negative,The hospital didn't have adequate accommodations for my family members who were visiting me.,hospital adequate accommodations family members visiting,"['hospital', 'adequate', 'accommodations', 'family', 'members', 'visiting']","[('hospital', 'n'), ('adequate', 'a'), ('accommodations', 'n'), ('family', 'n'), ('members', 'n'), ('visiting', 'v')]",  hospital adequate accommodation family member visit
Negative,The hospital didn't have adequate facilities for breastfeeding mothers.,hospital adequate facilities breastfeeding mothers,"['hospital', 'adequate', 'facilities', 'breastfeeding', 'mothers']","[('hospital', 'n'), ('adequate', 'n'), ('facilities', 'n'), ('breastfeeding', 'v'), ('mothers', 'n')]",  hospital adequate facility breastfeed mother
Negative,I felt that the hospital staff didn't respect my privacy or dignity during my treatment.,felt hospital staff respect privacy dignity treatment,"['felt', 'hospital', 'staff', 'respect', 'privacy', 'dignity', 'treatment']","[('felt', 'a'), ('hospital', 'a'), ('staff', 'n'), ('respect', 'n'), ('privacy', 'n'), ('dignity', 'n'), ('treatment', 'n')]",  felt hospital staff respect privacy dignity treatment
Negative,"I experienced delays in receiving my test results, causing anxiety and uncertainty.",experienced delays receiving test results causing anxiety uncertainty,"['experienced', 'delays', 'receiving', 'test', 'results', 'causing', 'anxiety', 'uncertainty']","[('experienced', 'a'), ('delays', 'n'), ('receiving', 'v'), ('test', 'n'), ('results', 'n'), ('causing', 'v'), ('anxiety', 'n'), ('uncertainty', 'n')]",  experienced delay receive test result cause anxiety uncertainty
Negative,"I received contradictory information from different doctors or nurses, causing confusion and frustration.",received contradictory information different doctors nurses causing confusion frustration,"['received', 'contradictory', 'information', 'different', 'doctors', 'nurses', 'causing', 'confusion', 'frustration']","[('received', 'v'), ('contradictory', 'a'), ('information', 'n'), ('different', 'a'), ('doctors', 'n'), ('nurses', 'n'), ('causing', 'v'), ('confusion', 'n'), ('frustration', 'n')]",  receive contradictory information different doctor nurse cause confusion frustration
Negative,"I experienced medical errors, such as incorrect dosages or misdiagnoses, that could have been prevented.",experienced medical errors incorrect dosages misdiagnoses could prevented,"['experienced', 'medical', 'errors', 'incorrect', 'dosages', 'misdiagnoses', 'could', 'prevented']","[('experienced', 'a'), ('medical', 'a'), ('errors', 'n'), ('incorrect', 'v'), ('dosages', 'n'), ('misdiagnoses', 'n'), ('could', None), ('prevented', 'v')]",  experienced medical error incorrect dosage misdiagnoses could prevent
Negative,The hospital didn't provide me with enough emotional support during my stay.,hospital provide enough emotional support stay,"['hospital', 'provide', 'enough', 'emotional', 'support', 'stay']","[('hospital', 'n'), ('provide', 'r'), ('enough', 'r'), ('emotional', 'a'), ('support', 'n'), ('stay', 'n')]",  hospital provide enough emotional support stay
Negative,The hospital didn't provide me with enough information about my discharge plan or aftercare instructions.,hospital provide enough information discharge plan aftercare instructions,"['hospital', 'provide', 'enough', 'information', 'discharge', 'plan', 'aftercare', 'instructions']","[('hospital', 'n'), ('provide', 'r'), ('enough', 'a'), ('information', 'n'), ('discharge', 'n'), ('plan', 'n'), ('aftercare', 'v'), ('instructions', 'n')]",  hospital provide enough information discharge plan aftercare instruction
Negative,"The hospital didn't have adequate accommodations for patients with disabilities, such as wheelchair ramps or elevators.",hospital adequate accommodations patients disabilities wheelchair ramps elevators,"['hospital', 'adequate', 'accommodations', 'patients', 'disabilities', 'wheelchair', 'ramps', 'elevators']","[('hospital', 'n'), ('adequate', 'a'), ('accommodations', 'n'), ('patients', 'n'), ('disabilities', 'n'), ('wheelchair', 'v'), ('ramps', 'n'), ('elevators', 'n')]",  hospital adequate accommodation patient disability wheelchair ramp elevator
Negative,The hospital didn't provide me with enough information about my insurance coverage or financial responsibilities.,hospital provide enough information insurance coverage financial responsibilities,"['hospital', 'provide', 'enough', 'information', 'insurance', 'coverage', 'financial', 'responsibilities']","[('hospital', 'n'), ('provide', 'r'), ('enough', 'a'), ('information', 'n'), ('insurance', 'n'), ('coverage', 'n'), ('financial', 'a'), ('responsibilities', 'n')]",  hospital provide enough information insurance coverage financial responsibility
Negative,I didn't feel that the hospital staff members were properly trained or qualified to provide the care that I needed.,feel hospital staff members properly trained qualified provide care needed,"['feel', 'hospital', 'staff', 'members', 'properly', 'trained', 'qualified', 'provide', 'care', 'needed']","[('feel', 'v'), ('hospital', 'a'), ('staff', 'n'), ('members', 'n'), ('properly', 'r'), ('trained', 'v'), ('qualified', 'a'), ('provide', 'n'), ('care', 'n'), ('needed', 'v')]",  feel hospital staff member properly train qualified provide care need
Negative,The hospital didn't provide me with enough information about the potential risks and benefits of undergoing a surgical procedure.,hospital provide enough information potential risks benefits undergoing surgical procedure,"['hospital', 'provide', 'enough', 'information', 'potential', 'risks', 'benefits', 'undergoing', 'surgical', 'procedure']","[('hospital', 'n'), ('provide', 'r'), ('enough', 'a'), ('information', 'n'), ('potential', 'n'), ('risks', 'n'), ('benefits', 'n'), ('undergoing', 'v'), ('surgical', 'a'), ('procedure', 'n')]",  hospital provide enough information potential risk benefit undergo surgical procedure
Negative,"The hospital was disorganized, causing delays and confusion in the treatment process.",hospital disorganized causing delays confusion treatment process,"['hospital', 'disorganized', 'causing', 'delays', 'confusion', 'treatment', 'process']","[('hospital', 'n'), ('disorganized', 'v'), ('causing', 'n'), ('delays', 'n'), ('confusion', 'n'), ('treatment', 'n'), ('process', 'n')]",  hospital disorganize causing delay confusion treatment process
Negative,The hospital didn't provide me with enough opportunities to provide feedback or voice my concerns.,hospital provide enough opportunities provide feedback voice concerns,"['hospital', 'provide', 'enough', 'opportunities', 'provide', 'feedback', 'voice', 'concerns']","[('hospital', 'n'), ('provide', 'r'), ('enough', 'r'), ('opportunities', 'n'), ('provide', 'v'), ('feedback', 'a'), ('voice', 'n'), ('concerns', 'n')]",  hospital provide enough opportunity provide feedback voice concern
Negative,The hospital didn't have adequate policies or procedures in place to address patient complaints or grievances.,hospital adequate policies procedures place address patient complaints grievances,"['hospital', 'adequate', 'policies', 'procedures', 'place', 'address', 'patient', 'complaints', 'grievances']","[('hospital', 'n'), ('adequate', 'a'), ('policies', 'n'), ('procedures', 'n'), ('place', 'v'), ('address', 'a'), ('patient', 'n'), ('complaints', 'n'), ('grievances', 'n')]",  hospital adequate policy procedure place address patient complaint grievance
Negative,I felt that the hospital staff members were dismissive of my pain or discomfort.,felt hospital staff members dismissive pain discomfort,"['felt', 'hospital', 'staff', 'members', 'dismissive', 'pain', 'discomfort']","[('felt', 'a'), ('hospital', 'a'), ('staff', 'n'), ('members', 'n'), ('dismissive', 'v'), ('pain', 'n'), ('discomfort', 'n')]",  felt hospital staff member dismissive pain discomfort
Negative,The hospital didn't provide me with enough information about the potential complications or risks of my treatment.,hospital provide enough information potential complications risks treatment,"['hospital', 'provide', 'enough', 'information', 'potential', 'complications', 'risks', 'treatment']","[('hospital', 'n'), ('provide', 'r'), ('enough', 'a'), ('information', 'n'), ('potential', 'a'), ('complications', 'n'), ('risks', 'n'), ('treatment', 'n')]",  hospital provide enough information potential complication risk treatment
Negative,"I experienced delays in receiving medical attention, causing me additional pain or discomfort.",experienced delays receiving medical attention causing additional pain discomfort,"['experienced', 'delays', 'receiving', 'medical', 'attention', 'causing', 'additional', 'pain', 'discomfort']","[('experienced', 'a'), ('delays', 'n'), ('receiving', 'v'), ('medical', 'a'), ('attention', 'n'), ('causing', 'v'), ('additional', 'a'), ('pain', 'n'), ('discomfort', 'n')]",  experienced delay receive medical attention cause additional pain discomfort
Negative,The hospital didn't provide me with enough information about my options for palliative or end-of-life care.,hospital provide enough information options palliative end life care,"['hospital', 'provide', 'enough', 'information', 'options', 'palliative', 'end', 'life', 'care']","[('hospital', 'n'), ('provide', 'r'), ('enough', 'a'), ('information', 'n'), ('options', 'n'), ('palliative', 'v'), ('end', 'a'), ('life', 'n'), ('care', 'n')]",  hospital provide enough information option palliative end life care
Negative,The hospital didn't provide me with enough opportunities to participate in my own care decisions or treatment planning.,hospital provide enough opportunities participate care decisions treatment planning,"['hospital', 'provide', 'enough', 'opportunities', 'participate', 'care', 'decisions', 'treatment', 'planning']","[('hospital', 'n'), ('provide', 'r'), ('enough', 'a'), ('opportunities', 'n'), ('participate', 'v'), ('care', 'n'), ('decisions', 'n'), ('treatment', 'n'), ('planning', 'n')]",  hospital provide enough opportunity participate care decision treatment planning
Negative,The hospital didn't provide me with enough information about my medical condition or the treatments that I was receiving.,hospital provide enough information medical condition treatments receiving,"['hospital', 'provide', 'enough', 'information', 'medical', 'condition', 'treatments', 'receiving']","[('hospital', 'n'), ('provide', 'r'), ('enough', 'a'), ('information', 'n'), ('medical', 'a'), ('condition', 'n'), ('treatments', 'n'), ('receiving', 'v')]",  hospital provide enough information medical condition treatment receive
Negative,I didn't feel that the hospital staff members were empathetic or understanding of my concerns or fears.,feel hospital staff members empathetic understanding concerns fears,"['feel', 'hospital', 'staff', 'members', 'empathetic', 'understanding', 'concerns', 'fears']","[('feel', 'v'), ('hospital', 'a'), ('staff', 'n'), ('members', 'n'), ('empathetic', 'a'), ('understanding', 'a'), ('concerns', 'n'), ('fears', 'n')]",  feel hospital staff member empathetic understanding concern fear
Negative,The hospital didn't provide me with enough information about the potential side effects or risks of undergoing a medical procedure.,hospital provide enough information potential side effects risks undergoing medical procedure,"['hospital', 'provide', 'enough', 'information', 'potential', 'side', 'effects', 'risks', 'undergoing', 'medical', 'procedure']","[('hospital', 'n'), ('provide', 'r'), ('enough', 'a'), ('information', 'n'), ('potential', 'a'), ('side', 'n'), ('effects', 'n'), ('risks', 'v'), ('undergoing', 'a'), ('medical', 'a'), ('procedure', 'n')]",  hospital provide enough information potential side effect risk undergoing medical procedure
Negative,"I experienced delays in receiving my medication or other necessary treatments, causing my condition to worsen.",experienced delays receiving medication necessary treatments causing condition worsen,"['experienced', 'delays', 'receiving', 'medication', 'necessary', 'treatments', 'causing', 'condition', 'worsen']","[('experienced', 'a'), ('delays', 'n'), ('receiving', 'v'), ('medication', 'n'), ('necessary', 'a'), ('treatments', 'n'), ('causing', 'v'), ('condition', 'n'), ('worsen', 'n')]",  experienced delay receive medication necessary treatment cause condition worsen
Negative,"The hospital didn't have adequate accommodations for patients who require medical equipment, such as oxygen tanks or mobility devices.",hospital adequate accommodations patients require medical equipment oxygen tanks mobility devices,"['hospital', 'adequate', 'accommodations', 'patients', 'require', 'medical', 'equipment', 'oxygen', 'tanks', 'mobility', 'devices']","[('hospital', 'n'), ('adequate', 'a'), ('accommodations', 'n'), ('patients', 'n'), ('require', 'v'), ('medical', 'a'), ('equipment', 'n'), ('oxygen', 'n'), ('tanks', 'n'), ('mobility', 'n'), ('devices', 'n')]",  hospital adequate accommodation patient require medical equipment oxygen tank mobility device
Negative,The hospital didn't provide me with enough information about the potential benefits of undergoing a medical procedure.,hospital provide enough information potential benefits undergoing medical procedure,"['hospital', 'provide', 'enough', 'information', 'potential', 'benefits', 'undergoing', 'medical', 'procedure']","[('hospital', 'n'), ('provide', 'r'), ('enough', 'a'), ('information', 'n'), ('potential', 'a'), ('benefits', 'n'), ('undergoing', 'v'), ('medical', 'a'), ('procedure', 'n')]",  hospital provide enough information potential benefit undergo medical procedure
Negative,I felt that the hospital staff members were rude or condescending towards me during my stay.,felt hospital staff members rude condescending towards stay,"['felt', 'hospital', 'staff', 'members', 'rude', 'condescending', 'towards', 'stay']","[('felt', 'a'), ('hospital', 'a'), ('staff', 'n'), ('members', 'n'), ('rude', 'v'), ('condescending', 'v'), ('towards', 'n'), ('stay', 'n')]",  felt hospital staff member rude condescend towards stay
Negative,The hospital didn't provide me with enough opportunities to ask questions or clarify my understanding of my medical condition or treatment options.,hospital provide enough opportunities ask questions clarify understanding medical condition treatment options,"['hospital', 'provide', 'enough', 'opportunities', 'ask', 'questions', 'clarify', 'understanding', 'medical', 'condition', 'treatment', 'options']","[('hospital', 'n'), ('provide', 'r'), ('enough', 'a'), ('opportunities', 'n'), ('ask', 'v'), ('questions', 'n'), ('clarify', 'v'), ('understanding', 'a'), ('medical', 'a'), ('condition', 'n'), ('treatment', 'n'), ('options', 'n')]",  hospital provide enough opportunity ask question clarify understanding medical condition treatment option
Negative,I didn't feel that the hospital staff members were adequately prepared or trained to handle medical emergencies.,feel hospital staff members adequately prepared trained handle medical emergencies,"['feel', 'hospital', 'staff', 'members', 'adequately', 'prepared', 'trained', 'handle', 'medical', 'emergencies']","[('feel', 'v'), ('hospital', 'a'), ('staff', 'n'), ('members', 'n'), ('adequately', 'r'), ('prepared', 'a'), ('trained', 'v'), ('handle', 'a'), ('medical', 'a'), ('emergencies', 'n')]",  feel hospital staff member adequately prepared train handle medical emergency
